{
  "components": {
    "MoleculeIconModeGallery": {
      "name": "MoleculeIconModeGallery",
      "root": {
        "children": [
          {
            "children": [
              {
                "id": "R0__T",
                "kind": "text",
                "props": {
                  "color": "#EBEBEB",
                  "content": "Text only",
                  "fontSize": 15,
                  "fontWeight": 600
                }
              }
            ],
            "id": "R0",
            "instanceKwargs": {
              "label": "Text only",
              "mode": "textOnly"
            },
            "instanceOf": "MoleculeIconTextRow",
            "kind": "layout",
            "props": {
              "align": "center",
              "background": "#F7F7F7",
              "cornerRadius": 4,
              "direction": "row",
              "gap": 8,
              "justify": "start",
              "padding": {
                "bottom": 10,
                "left": 14,
                "right": 14,
                "top": 10
              }
            }
          },
          {
            "children": [
              {
                "id": "R1__Lead",
                "kind": "icon",
                "props": {
                  "color": "#222222",
                  "icon": "star",
                  "size": 20
                }
              },
              {
                "id": "R1__T",
                "kind": "text",
                "props": {
                  "color": "#EBEBEB",
                  "content": "Leading",
                  "fontSize": 15,
                  "fontWeight": 600
                }
              }
            ],
            "id": "R1",
            "instanceKwargs": {
              "label": "Leading",
              "mode": "leadingIcon"
            },
            "instanceOf": "MoleculeIconTextRow",
            "kind": "layout",
            "props": {
              "align": "center",
              "background": "#F7F7F7",
              "cornerRadius": 4,
              "direction": "row",
              "gap": 8,
              "justify": "start",
              "padding": {
                "bottom": 10,
                "left": 14,
                "right": 14,
                "top": 10
              }
            }
          },
          {
            "children": [
              {
                "id": "R2__T",
                "kind": "text",
                "props": {
                  "color": "#EBEBEB",
                  "content": "Chevron",
                  "fontSize": 15,
                  "fontWeight": 600
                }
              },
              {
                "id": "R2__Chev",
                "kind": "icon",
                "props": {
                  "color": "#222222",
                  "icon": "chevron-right",
                  "size": 18
                }
              }
            ],
            "id": "R2",
            "instanceKwargs": {
              "label": "Chevron",
              "mode": "trailingChevron"
            },
            "instanceOf": "MoleculeIconTextRow",
            "kind": "layout",
            "props": {
              "align": "center",
              "background": "#F7F7F7",
              "cornerRadius": 4,
              "direction": "row",
              "gap": 8,
              "justify": "start",
              "padding": {
                "bottom": 10,
                "left": 14,
                "right": 14,
                "top": 10
              }
            }
          },
          {
            "children": [
              {
                "id": "R3__Lead",
                "kind": "icon",
                "props": {
                  "color": "#222222",
                  "icon": "star",
                  "size": 20
                }
              },
              {
                "id": "R3__T",
                "kind": "text",
                "props": {
                  "color": "#EBEBEB",
                  "content": "Both",
                  "fontSize": 15,
                  "fontWeight": 600
                }
              },
              {
                "id": "R3__Chev",
                "kind": "icon",
                "props": {
                  "color": "#222222",
                  "icon": "chevron-right",
                  "size": 18
                }
              }
            ],
            "id": "R3",
            "instanceKwargs": {
              "label": "Both",
              "mode": "both"
            },
            "instanceOf": "MoleculeIconTextRow",
            "kind": "layout",
            "props": {
              "align": "center",
              "background": "#F7F7F7",
              "cornerRadius": 4,
              "direction": "row",
              "gap": 8,
              "justify": "start",
              "padding": {
                "bottom": 10,
                "left": 14,
                "right": 14,
                "top": 10
              }
            }
          }
        ],
        "id": "Root",
        "kind": "layout",
        "props": {
          "background": "#EBEBEB",
          "direction": "column",
          "gap": 16,
          "padding": {
            "bottom": 16,
            "left": 16,
            "right": 16,
            "top": 16
          }
        }
      },
      "rootKind": "layout"
    },
    "MoleculeIconTextRow": {
      "bakedParams": {
        "label": "Continue",
        "mode": "textOnly"
      },
      "name": "MoleculeIconTextRow",
      "root": {
        "children": [
          {
            "id": "T",
            "kind": "text",
            "props": {
              "color": "#EBEBEB",
              "content": "Continue",
              "fontSize": 15,
              "fontWeight": 600
            }
          }
        ],
        "id": "Root",
        "kind": "layout",
        "props": {
          "align": "center",
          "background": "#F7F7F7",
          "cornerRadius": 4,
          "direction": "row",
          "gap": 8,
          "justify": "start",
          "padding": {
            "bottom": 10,
            "left": 14,
            "right": 14,
            "top": 10
          }
        }
      },
      "rootKind": "layout"
    }
  },
  "generatedAt": "2026-08-05T23:46:01.574Z",
  "provenance": {
    "bakeProfile": "system-defaults",
    "bakedTheme": null,
    "entryPath": "/workspace/test-fixtures/pdl/molecules/m_03_button_icon_chevron.pdl"
  },
  "schemaKind": "bakedDesign",
  "schemaVersion": "1.0.0-beta"
}
