{
  "components": {
    "Glyph": {
      "bakedParams": {
        "previewBackground": "#F4F4F5",
        "sizeClass": "medium",
        "surface": "mobile"
      },
      "name": "Glyph",
      "root": {
        "children": [
          {
            "id": "mark",
            "kind": "icon",
            "props": {
              "color": "#FAFAFA",
              "icon": {
                "kind": "iconRef",
                "name": "heart.fill",
                "source": "system",
                "system": "sfSymbols"
              },
              "size": 16
            }
          }
        ],
        "id": "Root",
        "kind": "layout",
        "props": {
          "background": "#18181B"
        }
      },
      "rootKind": "layout"
    }
  },
  "generatedAt": "1970-01-01T00:00:00.000Z",
  "previewBackground": "#F4F4F5",
  "provenance": {
    "bakeProfile": "component-explicit",
    "bakedTheme": "Dark",
    "entryPath": "test-fixtures/pdl/lab/host/design.pdl"
  },
  "schemaKind": "bakedDesign",
  "schemaVersion": "1.0.0-beta"
}
