{
  "components": {
    "AtomDeferredChildren": {
      "name": "AtomDeferredChildren",
      "root": {
        "children": [
          {
            "children": [
              {
                "id": "A",
                "kind": "layout",
                "props": {
                  "background": "#D3D3D3",
                  "direction": "column",
                  "padding": {
                    "bottom": 8,
                    "left": 8,
                    "right": 8,
                    "top": 8
                  }
                }
              },
              {
                "id": "B",
                "kind": "layout",
                "props": {
                  "background": "#222222",
                  "direction": "column",
                  "padding": {
                    "bottom": 8,
                    "left": 8,
                    "right": 8,
                    "top": 8
                  }
                }
              }
            ],
            "id": "Row",
            "kind": "layout",
            "props": {
              "background": "#F7F7F7",
              "direction": "row",
              "gap": 8
            }
          }
        ],
        "id": "Root",
        "kind": "layout"
      },
      "rootKind": "layout"
    }
  },
  "generatedAt": "2026-08-05T23:45:15.391Z",
  "provenance": {
    "bakeProfile": "system-defaults",
    "bakedTheme": null,
    "entryPath": "/workspace/test-fixtures/pdl/atoms/deferred_children_atoms.pdl"
  },
  "schemaKind": "bakedDesign",
  "schemaVersion": "1.0.0-beta"
}
