{
  "components": {
    "AtomExposedCard": {
      "bakedParams": {
        "showBorder": false,
        "subtitle": "Subtitle",
        "title": "Card"
      },
      "name": "AtomExposedCard",
      "root": {
        "children": [
          {
            "id": "T",
            "kind": "text",
            "props": {
              "color": "#EBEBEB",
              "content": "Card",
              "fontSize": 18,
              "fontWeight": 600
            }
          },
          {
            "id": "S",
            "kind": "text",
            "props": {
              "color": "#222222",
              "content": "Subtitle",
              "fontSize": 12
            }
          }
        ],
        "id": "Root",
        "kind": "layout",
        "props": {
          "background": "#F7F7F7",
          "direction": "column",
          "gap": 4,
          "padding": {
            "bottom": 8,
            "left": 16,
            "right": 16,
            "top": 8
          }
        }
      },
      "rootKind": "layout"
    }
  },
  "generatedAt": "2026-08-05T23:45:17.637Z",
  "provenance": {
    "bakeProfile": "system-defaults",
    "bakedTheme": null,
    "entryPath": "/workspace/test-fixtures/pdl/atoms/expose_atoms.pdl"
  },
  "schemaKind": "bakedDesign",
  "schemaVersion": "1.0.0-beta"
}
