{
  "components": {
    "MoleculeMatrixButton": {
      "bakedParams": {
        "kind": "primary",
        "label": "Submit",
        "size": "regular"
      },
      "name": "MoleculeMatrixButton",
      "root": {
        "children": [
          {
            "id": "L",
            "kind": "text",
            "props": {
              "color": "#EBEBEB",
              "content": "Submit",
              "fontSize": 16,
              "fontWeight": 600
            }
          }
        ],
        "id": "Root",
        "kind": "layout",
        "props": {
          "align": "center",
          "background": "#D3D3D3",
          "cornerRadius": 8,
          "direction": "row",
          "justify": "center",
          "padding": {
            "bottom": 12,
            "left": 20,
            "right": 20,
            "top": 12
          },
          "wrap": "nowrap"
        }
      },
      "rootKind": "layout"
    },
    "MoleculeMatrixButtonGallery": {
      "name": "MoleculeMatrixButtonGallery",
      "root": {
        "children": [
          {
            "children": [
              {
                "id": "R0__L",
                "kind": "text",
                "props": {
                  "color": "#EBEBEB",
                  "content": "P compact",
                  "fontSize": 12,
                  "fontWeight": 600
                }
              }
            ],
            "id": "R0",
            "instanceKwargs": {
              "kind": "primary",
              "label": "P compact",
              "size": "compact"
            },
            "instanceOf": "MoleculeMatrixButton",
            "kind": "layout",
            "props": {
              "align": "center",
              "background": "#F7F7F7",
              "cornerRadius": 8,
              "direction": "row",
              "justify": "center",
              "padding": {
                "bottom": 5,
                "left": 10,
                "right": 10,
                "top": 5
              },
              "wrap": "nowrap"
            }
          },
          {
            "children": [
              {
                "id": "R1__L",
                "kind": "text",
                "props": {
                  "color": "#EBEBEB",
                  "content": "P regular",
                  "fontSize": 16,
                  "fontWeight": 600
                }
              }
            ],
            "id": "R1",
            "instanceKwargs": {
              "kind": "primary",
              "label": "P regular",
              "size": "regular"
            },
            "instanceOf": "MoleculeMatrixButton",
            "kind": "layout",
            "props": {
              "align": "center",
              "background": "#D3D3D3",
              "cornerRadius": 8,
              "direction": "row",
              "justify": "center",
              "padding": {
                "bottom": 12,
                "left": 20,
                "right": 20,
                "top": 12
              },
              "wrap": "nowrap"
            }
          },
          {
            "children": [
              {
                "id": "R2__L",
                "kind": "text",
                "props": {
                  "color": "#EBEBEB",
                  "content": "S compact",
                  "fontSize": 12,
                  "fontWeight": 600
                }
              }
            ],
            "id": "R2",
            "instanceKwargs": {
              "kind": "secondary",
              "label": "S compact",
              "size": "compact"
            },
            "instanceOf": "MoleculeMatrixButton",
            "kind": "layout",
            "props": {
              "align": "center",
              "background": "#EBEBEB",
              "cornerRadius": 8,
              "direction": "row",
              "justify": "center",
              "padding": {
                "bottom": 4,
                "left": 8,
                "right": 8,
                "top": 4
              },
              "wrap": "nowrap"
            }
          },
          {
            "children": [
              {
                "id": "R3__L",
                "kind": "text",
                "props": {
                  "color": "#EBEBEB",
                  "content": "D regular",
                  "fontSize": 16,
                  "fontWeight": 600
                }
              }
            ],
            "id": "R3",
            "instanceKwargs": {
              "kind": "danger",
              "label": "D regular",
              "size": "regular"
            },
            "instanceOf": "MoleculeMatrixButton",
            "kind": "layout",
            "props": {
              "align": "center",
              "background": "#F7F7F7",
              "cornerRadius": 8,
              "direction": "row",
              "justify": "center",
              "padding": {
                "bottom": 10,
                "left": 16,
                "right": 16,
                "top": 10
              },
              "wrap": "nowrap"
            }
          }
        ],
        "id": "Root",
        "kind": "layout",
        "props": {
          "background": "#D3D3D3",
          "direction": "column",
          "gap": 16,
          "padding": {
            "bottom": 16,
            "left": 16,
            "right": 16,
            "top": 16
          }
        }
      },
      "rootKind": "layout"
    }
  },
  "generatedAt": "2026-08-05T23:46:02.710Z",
  "provenance": {
    "bakeProfile": "system-defaults",
    "bakedTheme": null,
    "entryPath": "/workspace/test-fixtures/pdl/molecules/m_04_button_variant_matrix.pdl"
  },
  "schemaKind": "bakedDesign",
  "schemaVersion": "1.0.0-beta"
}
