{
  "components": {
    "CompanionBlock": {
      "bakedParams": {
        "tone": "neutral"
      },
      "name": "CompanionBlock",
      "root": {
        "children": [
          {
            "id": "L",
            "kind": "text",
            "props": {
              "color": "#717171",
              "content": "Hi",
              "fontFamily": "system-ui, sans-serif",
              "fontSize": 12,
              "fontWeight": 600,
              "letterSpacing": 0.02,
              "lineHeight": 1.2
            }
          }
        ],
        "id": "Root",
        "kind": "layout",
        "props": {
          "direction": "row"
        }
      },
      "rootKind": "layout"
    }
  },
  "generatedAt": "2026-08-05T23:45:45.715Z",
  "provenance": {
    "bakeProfile": "system-defaults",
    "bakedTheme": null,
    "entryPath": "/workspace/test-fixtures/pdl/integration/companion_extend_entry.pdl"
  },
  "schemaKind": "bakedDesign",
  "schemaVersion": "1.0.0-beta"
}
