{
  "components": {
    "Box": {
      "name": "Box",
      "root": {
        "id": "Root",
        "kind": "layout",
        "props": {
          "background": "#FFFFFF"
        }
      },
      "rootKind": "layout"
    }
  },
  "generatedAt": "2026-08-05T23:45:55.881Z",
  "provenance": {
    "bakeProfile": "system-defaults",
    "bakedTheme": null,
    "entryPath": "/workspace/test-fixtures/pdl/integration/themed.pdl"
  },
  "schemaKind": "bakedDesign",
  "schemaVersion": "1.0.0-beta"
}
